,id,sentiment,tweet,label
2893,629774727641473024,positive, wil probably give it another try in the future I wasnt into Game of Thrones at st try but I kept watching amp it grew on me,1
2894,629821447423295488,positive,Realy tired Great day Going to put my fet up and watch Game Of Thrones maybe Agents Of Shield Night Cya tomorow,1
2895,629975347140759552,neutral, more seasons of Game of Thrones Cmon You can at least make seasonsright Is that to much to ask Ok is fine,0
2896,630154594652422145,neutral,So as someone who just got the Game of Thrones nd ed LCG what websites should I be going to for decklists discusions etc,0
2897,630274554255044608,positive,The emotional rolercoaster that is watching the entire th season of Game of Thrones in a single day has come to an end,1
2898,630483104977788928,positive,Get back on the th and have days or so until movein day at Northwestern which I hope is enough time to binge watch Game of Thrones,1
2899,630528630469345280,positive,Its sunday so you know what that means Taking over with episode of Game of Thrones come on down ,1
2900,630543646635462656,positive, Definitely posible I do it al the time with Game of Thrones I may even like the series beter hides,1
2901,630866342837624833,neutral,Im just going to have to delete al social media in the time betwen the releases of the th series and the th bok of Game of Thrones,0
2902,630895602293805056,neutral, Im one of the few who agre with you about Game of Thrones I also tried the st season and gave up Dark dom and glom,0
2903,630909927599411200,positive,So Il start watching the st season of Game of Thrones tonight We ,1
2904,630949132954238976,negative,Game of Thrones season for fre may sem to god to be true but thats only cause it is My day went back to being terible,-1
2905,631037906941902854,positive, Hey Erin when do you think Teltale is going release the th Episode of Game of Thrones I realy love that game,1
2906,631465772422983680,positive,Game Of Thrones without the sex bobs badasnes Knights prostitutes women and a lot more Netflix is basicaly my Friday evening,1
2907,631594318860562432,positive,Ned Stark may be back for Game of Thrones Season Heres what it means via GameofThrones,1
2908,631964211145347072,positive,Tel us what GoToHexIsLike and it may be read on our Podcast Ex GoToHexIsLike Game of Thrones but replace the Dragons with Dicks,1
2909,632393900813090816,positive, heard great things about the audio versions of Game of Thrones although the prefered reader did not read the th bok,1
2910,632490697086627840,positive,Saturday morning domestic blis is wife teaching y son how to play the theme song of Game of Thrones on the piano,1
2911,632572762771587072,positive,Nothing like starting your Saturday with marathoning Game Of Thrones until you finish the entire series on HBO GO,1
2912,632615772905275392,positive,I am watching the Hardhome episode of Game of Thrones for the th time and I vote,1
2913,632635131174473728,positive,One last Sunday night without Game of Thrones Thank the Gods,1
2914,632726938130481152,neutral, Mentioned in Babylon the name of episode in th season and Game of Thrones th episode nd season popculture,0
2915,633106713739071488,positive,Another new episode of Dragon Bal Super Thank you Sundays you have given me hope until Game Of Thrones comes back in my life,1
2916,633149264424759296,positive, I though you may want that you and the rest of the crew swet talked me into buying Game Of Thrones Im hoked,1
2917,633403210720526336,neutral,Do you have to watch Game of Thrones from the first season or can you start watching the th first,0
2918,633543205770805249,negative,Im so frustrated with Game of Thrones and Im only on the th episode,-1
2919,633586962360848384,neutral,Just spent mins trying to make the Iron Throne from Game Of Thrones out of Jockey Whips for the big clash tomorow Fail ,0
2920,633628625670156288,positive,Game of Thrones season premieres on April on HBO Are you ready Watch the trailer and col m ,1
2921,633655643862364160,positive,The worst thing about going back to schol tomorow is not being able to watch Game of Thrones al day,1
2922,633937186233053189,positive,Its okay if its almost am and ive had no slep in like thre days cos im on the th season of Game of Thrones so whos the real winer here,1
2923,634077729340719104,neutral, just show them the last episode of Game Of Thrones on nd thoughts Dont lol,0
2924,634081944297451524,positive,The st season of Game Of Thrones is so amazing Re watching it again,1
2925,634117817982320640,positive, Cmon stick around Itl about to get Game of Thrones level blody on here,1
2926,634132209230856192,neutral,Since I wont stream DR til friday I might as wel continue Game of Thrones for the time being ,0
2927,634205593914445824,positive,I move in tomorow and Im not done packing but like Maybe Il just binge watch Game of Thrones,1
2928,634208020617121792,positive, Hes the nd Dario from Game Of Thrones whos more charming than the original ,1
2929,634348300536254464,neutral, I once sat next to an actor out of Game of Thrones on the tube Doesnt mean Im friends with said actor,0
2930,634513856971341824,neutral,While Game of Thrones is set in fantasy world it loks like we may have a realife co ,0
2931,634594614335246336,positive, To whom it may concern I ate a bunch of cashew ice cream while watching Game of Thrones,1
2932,634595939366383616,positive, is ful on fangirling as were sat just over from Game Of Thrones Iain Glen Jorah Mormont at St Pancras,1
2933,634844559365828608,neutral,Ive ben trying to watch Game of Thrones but Im only on the th episode of season FML,0
2934,634859348683059200,positive, my Friday night is spent watching Game Of Thrones with dad Haha,1
2935,634887968231190528,positive,Il be out of town on vacation til wednesday so I wont be on the stream tonight Once Im back it is time for more Game of Thrones,1
2936,634942658729766912,positive,Friday night Mom bringing home a taco for me while I watch Game of Thrones with my dog,1
2937,634959768801558528,positive,Im siting down on my th hour of Game Of Thrones eatin girl scout cokies does it lok or even sound like I care what your thoughts are,1
2938,634991095513022464,positive,Met the South African who put Game of Thrones on the map gt in SundayTimes Lifestyle tomorow,1
2939,635055228841250816,positive,Gona clean up my whole rom put on fresh shets and jamies and watch Game of Thrones al day before a long day of work tomorow,1
2940,635172610729484289,positive,Remember when Game Of Thrones was on TV in SA the same time as in America Forget the poverty we were a st world country for those weks,1
2941,635235612866551808,positive,I think tomorow Im just going to binge watch the last episodes of Game of Thrones get it over and done with then start on Walking Dead,1
2942,635388511495962624,positive,Ive cried les over my last breakup than ive cried over the th season of Game of Thrones ,1
2943,635409861476503552,positive,The Hound from Game of Thrones is making a Lemon and Pistachio cake on Sunday Brunch blody fantastic start to the day,1
2944,635479451438944256,positive,Ive made it a goal to get caught up with Game of Thrones by the th and Im near the end of season Lets do this ,1
2945,635576181623009281,positive,Me waiting for the th season of Game Of Thrones ,1
2946,635619706393743360,neutral,Hi my name is and I may or may not be obsesed with Game of Thrones and al the ad ons it brings to my smart tv as I watch it ilegaly,0
2947,635626828531568641,neutral,Why do I have to go to clas tomorow isnt colege just watching Game of Thrones,0
2948,635701179847020544,positive,George R Martin at peace with Game of Thrones finishing before A GameOfThrones,1
2949,635746281579773952,positive,Why do Monday when you can do a glorified Sunday Breakfast in bed with Game of Thrones Done,1
2950,635925224589012993,negative,Desperately trying to stick with Game of Thrones but episodes into the st series and Im losing interest rapid,-1
2951,636009004783693825,negative,One of my favorite characters on Game Of Thrones just died I cant go to schol tomorow Im grieving,-1
2952,636096176639582209,neutral,Like Nathalie Emanuel is bothered shes not ben asked to Holyoaks th aniversary when shes now in Game of Thrones,0
2953,636351784915628032,negative,Everytime I rereadre watch Game of Thrones Ned Starks death at the end of the st bokseason is the most depresing GoT,-1
2954,636377574319460352,positive,Day of tomorow going to use it to be very productive and by productive I mean watch a lot of Game of Thrones,1
2955,636415631374442496,neutral,I may not be friend anymore if she doesnt watch AT LEAST the first episode of Game of Thrones Like cmon give it a shot,0
2956,636646607790804992,neutral,I may or may not have put a song from the Game of Thrones soundtrack on the playlist for the yoga clas Im teaching tonight,0
2957,636677401519505408,neutral,May start watching the walking dead in the absence of Game of Thrones,0
2958,636807395675521024,positive,or just start watching Game of Thrones and be like il finish it tomorow before ,1
2959,637030662592155648,positive,Thank you to al the awesome people who suported the cast tonight Game Of Thrones is amazing Might have a suprise game tomorow,1
2960,637279019898040320,negative,Before George R R Martin finishes the next bok some of the Game of Thrones actors may die of natural causes Take your time George,-1
2961,637853791501463552,positive,I just spoke with my mom on the phone for minutes She finished the th season of Game of Thrones Very exciting,1
2962,638000474143227905,positive, it may be awesome like the wal in Game of Thrones ,1
2963,638555027519459328,neutral,Wine drunk on a Monday and watching Game of Thrones with my mother What is tonight,0
2964,638837324990705664,positive,Early start tomorow so of to bed with a mug of peanut hotie and late to the party but finaly going to start watching Game Of Thrones,1
2965,638845629721112576,neutral,I ask of Tuesdays and Thursdays from work so I have a whole day to do homework Al Ive done is eaten junk and watched Game of Thrones,0
2966,638891242168807424,negative,Ive sat through five seasons of Game of Thrones and I stil couldnt tel you a single characters name,-1
2967,638900876548018176,positive,Ive watched thre seasons of Game of Thrones since Saturday Now Im going to start season My life is exciting,1
2968,639273561224417280,positive,Great job tonight I heard you may be a fan of Game of Thrones ,1
2969,639466101630341120,positive,Thanks to everyone who came over and played the Game of Thrones with us today Se you tomorow PlayTheGame NursingORGWhy WeILUMINATE,1
2970,639469464568877058,positive,Game of Thrones just cast a character who may have a huge role next season GameOfThrones GOT GOTonUBOx UBox ,1
2971,639562406218207232,positive,Ed Skrein Game of Thrones st Dario Explains Why He Left the HBO ShowFind Out What He Said ,1
2972,639570810902941696,positive, Until Louie th every diner guest came with his own knife aka armed Watch GOT Game of Thrones Red Weding,1
2973,639835421548126209,positive,Thanks again for the amazing gift I cant wait to watch al the nd season again of Game of Thrones ,1
2974,639950082591232000,positive,If anyone is interested I have a piza in the oven and the boxed set of Game Of Thrones on bluray Friday TurnDownForWhat,1
2975,639987495514435584,positive, If JK was on Game of Thrones his name would be Jurgen Klinsman Master of the th Substitution of the Friendly Clan,1
2976,640171100622716928,negative,Watching the st series of Game of Thrones is bringing back painful memories,-1
2977,640269264709120000,positive, Got through two episodes of the Game of Thrones one just now May play more of it later,1
2978,640339568626167808,positive, Hary Poter Percy Jackson Thursday Next Game of Thrones or Pilars of the Earth are mine S,1
2979,640350212913893378,neutral, my brother wants to hear the Game of Thrones theme or the Imperial March vancanadians,0
2980,640504419633770496,positive,Just finished the paper neded for tomorows exams I think I DESERVE to watch an episode of Game of Thrones I just do Its only fair,1
2981,640750132917612545,positive,I honestly think this is the th time Ive tried to get through the pilot episode of Game of Thrones mustpushthrough,1
2982,641323370148184064,positive,I moved in on Friday and Ive already watched al of Game of Thrones on the tv,1
2983,641348835575357441,positive,Switching it up with some TelTale Tuesday tonight Walking Dead Game of Thrones or Wolf Among Us,1
2984,641583200586829824,positive,Visual efects work done with Image Engine for the th season of Game of Thrones ,1
2985,641616075864584192,neutral,Peter Dinklage talks Game of Thrones season six and how he let his hair down Herald Sun ,0
2986,641377353013329920,neutral, We do have an option for Gogle Walet that you may use as an alternative TW,0
2987,641380001225551872,neutral,Are you losing organic Gogle trafic from April st ,0
2988,641384392179478528,positive,Mr Angelos helping the ZCMS th graders create their own Gogle Site Zion ,1
2989,641388263442411520,negative, had cpl seasns but cmon nowdoesnt take a genius to gogle how bad you guys wereOSU NEVER ben that bad,-1
2990,641392596607107073,neutral,SEO Services Jacksonvile Florida Do you want to list your website in Gogle st ,0
2991,641392750001131520,neutral,Cmon Some signage Some way finding signs Anything How about tel Gogle where your various bldgs are,0
2992,641394997808513024,neutral, tom in gogle play tomorow day,0
2993,641396881801785345,neutral,Gogle is surprisingly unhelpful at providing the cubic oxygen intake per minute of an average adult weasel Cmon Gogle get it together,0
2994,641403096090841088,positive, Get the ap Saturday wil be here before you know it Ap Store Gogle Play ,1
2995,641403365876826112,neutral,This may be true and it means that Gogle is not acounting for local culture in driving paterns a ux fail ,0
2996,641403777187213316,positive,Gogle did great with YouTube purchase It is now gt BN I bet Facebok did equaly if not beter with Oculus,1
2997,641406787829153796,negative, LOL st of itd be wahze Israeli start up dev in sold to Gogle maps in for Bil SoNotFair,-1
2998,641407938687401984,neutral, Were you able to fil out the Gogle Form to register for the show on the th,0
2999,641408516759101440,negative, If you Gogle his name you may know why he is no longer invited,-1
3000,641414825520832514,negative,The wildest lie I told a chick when I loved in ATL I told her I just got drafted to the Falcons in the th round before Gogle was popin,-1
3001,641416150102974464,neutral,Gogled the snake I steped over on the trail Sunday Baby timber ratler So time to Gogle snakeprof hiking bots,0
3002,641420148306522116,neutral, F bro from is coking in the FidleNPig shindig BQ peoples choice comp wHoly Smoke team Sat in Ft Mil Gogle it,0
3003,641426968018157568,neutral,I tried to gogle how to get rid of fruit flies and then just sat for minutes imagining what the wikihow for geting rid of me would be,0
3004,641427382365257729,neutral, Have you tried any rd party aps or services to back up Like with your Gogle acount or cloud services Ace,0
3005,641428032587231232,neutral,Yes I backup with Gogle and Dropbox ,0
3006,641432180443480064,neutral,The show just ended Voting is open until am EST tomorow TY AL ways to vote Gogle AGT and click GARY ,0
3007,641433136811917312,positive,Through the Gogle lens Search Trends August September ,1
3008,641434794027454469,neutral, Lomeli Cmon man Gogle I think about to conect to decode kyhwana I fel sily I just about bet,0
3009,641439696673861632,neutral, Gogle is a beast bo but thats the wrong Angela Robinson Sept th Jacksonvile FL,0
3010,641440430341664768,positive, In case you havent already grabed it May I ofer you a fre fantasy ebok Amazon Gogle,1
3011,641441320637231106,neutral,Teacher make sure you prep for your esay tomorow Me goes home and loks up big words on Gogle,0
3012,641441330107953153,neutral,GoPo we broke the Gogle Wil give you new instructions tomorow in clas,0
3013,641441920322011136,neutral,Got this group presentation due thursday for my IT clas and today we just spent teaching this mom in my clas how to use gogle drive smh,0
3014,641446319928811520,neutral,you dont even have to be in med schol to know nhs wages theyre not a big secret you can straight up gogle that shit like cmon,0
3015,641446328350863360,neutral, be careful Gogle did break and hold on the upside the MA Wil test that MA tomorow,0
3016,641453194095169536,positive,Adblock Browser for Android now available on Gogle Play but it might not be for September Col Tech,1
3017,641453642768236544,negative, Hey idiot To bad You have lost You may have read about the SCOTUS decision Obergefel Gogle that ,-1
3018,641457637473824768,neutral, expect a welcome post tomorow I urge you to gogle Jacqueline M James,0
3019,641459711045443584,negative, Hadnt read the ful thread on st reply I forgot people might not know Gogle isnt live results,-1
3020,641460320293122049,positive,Using this tomorow Practical Ed Tech Tip of the Wek Create a Random Name Selector in Gogle Shets via ,1
3021,641463144578195456,neutral,What time is the Aple anounment tomorow I didnt fel like going al that in Gogle,0
3022,641469662073630721,neutral,The word conotes wil be one of the most searched for words on Gogle tomorow lateshow,0
3023,641475286228271108,negative,I think Gogle may be woried that if they alow people just to ad sites on Gogle Now then people wil use it like Gogle Reader,-1
3024,641475362313097216,negative,That moment when you think Gogle search ads for that distortion pedal showed up on your twiter fed Nope ,-1
3025,641483510939713537,neutral, Do you have a gogle plus acount if so may i have the link to it,0
3026,641485990964494337,positive, you ned rd party launcher like Nova or an activity launcher then Gogle Play Services gt AndroidPay and done ,1
3027,641495377724735488,positive, years in the SEO Industry proving st page rankings on Gogle Fre Quote SEO Gogle socialmedia,1
3028,641498018768773120,neutral, Yes mamBeter Gogle it You know some people dont have any workamp may create it as a big sceneThiz hapening for many celebTc,0
3029,641503832246124545,neutral,Tomorow Gogle Play changes how it deals w digital tax in Norway Moroco amp Albania ,0
3030,641504309293793280,neutral,Gogle sems to think the site may be hacked ,0
3031,641509914297409536,neutral,Woman with a smartphone asking for directions as if Gogle maps doesnt exist Phone may be smart the user wasnt,0
3032,641510534727139328,neutral,Gogles new logo may lok like a preschols sign but its also a fraction of the size of the old one serifprobs ,0
3033,641513233937862656,negative,th grader voice Go to Gogle and lok up meatspin but make sure ur mom isnt loking,-1
3034,641517143603810304,positive,Make sure you join our live InterfaceSpeaks Gogle Hangout tomorow amp talk al things ecodesign at pm GMT ,1
3035,641521512298606592,positive,Not the same digest in relation to the gogle android wafer other self january complement other self ivsH ,1
3036,641527694430195712,negative, Sory am rubish at posting links Gogle Spikes disease border terier and it wil come up Ours st signs were at around ,-1
3037,641528118805528576,neutral,fotolog if we ned more electricity gogle neds to aprove it He plugs sun for their power eficiency,0
3038,641531021402460160,positive,Morning Twiter Is your main SEO aim to be st on Gogles search results Youre probably mising the point of SEO ,1
3039,641535329007071234,neutral, Alright Thank you for the details You may contact Gogle on this ,0
3040,641538154894368768,neutral, sounds like you may ned a nightguard Gogle bruxism,0
3041,641543337950908416,positive,Not new but worth reading again if you have already Gogles Hiring Wishlist learning cognition,1
3042,641544735518134272,negative,Gogle forgot second page as wel forgot many things The fax And a bunch of other things Told work to expect it on friday,-1
3043,641545508935208960,negative, XD my brain may be a litle wounded from translating gogle translate or a lack of nourishment one or the other D,-1
3044,641548065040658436,neutral, got Amazon last Thursday got IOS last night but the update isnt showing in Gogle play store yet,0
3045,641552529256378368,positive, sure kep calm and use gogle search engine may be one day you get what you are loking for ,1
3046,641554219481309184,positive,Rank Among st page of Gogle in weks with your Website SEO Ful read by eBay ,1
3047,641560372567277568,positive, congrats on the bok invites to ad value from HR Any thoughts you may share about internal comunications in Gogle,1
3048,641562484822831105,positive,GOGLE CERN wil open the BOTOMLES PIT of Prophecy Sep RD ,1
3049,641568168880640001,neutral, I may or may not have searched it up on gogle,0
3050,641570334894915584,neutral,What DepLearning and MachineLearning Mean For the Future of SEO amp Gogles Search Moz ,0
3051,641570539664973824,positive,Learn the basics of Gogle Adwords Do You Want More Clients The Next Step Bristol September ,1
3052,641578331603890176,neutral,Next time Gogle redesigns its logo it should so hire our readers to do it SO much beter ,0
3053,641582161007501312,neutral, But Constantine ordered the Sabath to be changed from Saturday to Sunday Gogle Constantine AD,0
3054,641585261512515584,neutral,Gogles new project helps you stick your solar panels where the sun shines ,0
3055,641585621182582784,positive,How To Find Your Links In Gogle Proportionately you may light part of geting ranked high on Gogle or ,1
3056,641588327192350721,neutral, Ah gogle has her alive on the st June Expres interview as does wikipedia but ,0
3057,641594978251186176,neutral, may be able to find out same info with Gogle,0
3058,641598020484767744,positive,Today is International FASD Awarenes Day and September is Awarenes Month Please take the time today to Gogle ,1
3059,641603270943703040,neutral, By gogle i mean the search engine gogle maps gogle email acounts anything gogle you may have,0
3060,641605732778024960,positive,My predictions for the Aple event Aple have bought Tesla Uber and Gogle cars as of tomorow car ownership is now a thing of the past,1
3061,641605872662237184,positive,Get Your Busines on the st Page of Gogle DIYSEO Tuesday September th constantcontact ,1
3062,641606702849224704,negative, Was having trouble yesterday downloading Septembers edition using Gogle Loads the st page then crashes,-1
3063,641608320374185984,neutral,The gap is closing betwen number one Gogle and number two Facebok on the top digitaladvertisingenerating companies and Pandora is th,0
3064,641609440412729344,neutral,Jokes aside seing a bunch of awful alternatives is a god way to get sold on the new Gogle logo ,0
3065,641619855154638848,positive,Amid the buz of Gogles new logo last Monday a lot of people mised Tuesdays anouncement that native Gmail ,1
3066,641622485302157312,neutral,Gogle results are localised so I may wel only show up so high if youre in the UK,0
3067,641626244199632896,positive,YouTube description st lines are critical bc they apear in Gogle search results kep keyword at the top INBOUND,1
3068,641626405671796736,positive,This loks interestingand you can sign in with your Gogle acount SAT Practice on Khan Academy via ,1
3069,641633915258716160,neutral, Bring sumer reading boks for Friday Log in to Gogle Clasrom and the online bok by Friday,0
3070,641636108053278720,positive,BOM Nexus LAUNCHES Sept With Android Marshmalow In Tow This was Gogles main USP with its Nexus ,1
3071,641637278763216896,neutral,Our paper neds to be turned into blackboard and Gogle by midnight on friday it neds to be les than on blackboard aumrsch,0
3072,641639262337769472,positive, In a Geography clas tomorow with Gogle great starter geographyteacher,1
3073,641639586511253504,positive,Colaboration shared gogle docs and group share outs al on the nd day of schol Saline stds rock smslearn ,1
3074,641640490597675009,neutral,Of note when you Gogle pegasus the st phrase prompt is pegasus hobies,0
3075,641642126992928769,neutral,RADIO s juice Now Playing Walkin on the Sun Smash Mouth APS Aple Gogle ,0
3076,641643703996563459,positive,Gogle hangout anime sesion if crunchyrol picks up for the fal season ,1
3077,641645363540037632,positive,What colour is the second g in Gogle no gogling Biancas back SEs most refreshing quiz Thurs pm ,1
3078,641645457182191616,neutral,How Gogle May Answer Questions in Queries with Rich Content Results ,0
3079,641645633565134849,negative,Expres bus to downtown Fort Lauderdale may be cut It loks like the end of the road for expres bus s Gogle,-1
3080,641649311864897536,positive,Make sure you go cop my EP August th on Itunes and gogle play You can stream it on spotify ,1
3081,641650166357848064,positive,Talking Gogle wafles with our very own Mrs McDaniel on wafle Wednesday curtisES whywisd ,1
3082,641650373506244609,positive,Gogle to kil single most anoying thing about browsing the Web August CNMoney ,1
3083,641651472967540736,neutral,Sat crying at Gogle I literaly am so proud of people who go out every single day of their lives when its so fucking dificult,0
3084,641654805799112704,neutral,But Gogle play wil receive the update tomorow,0
3085,641656929408778240,positive, This ap is very useful specialy when finding restaurants you may download this ap on Gogle play store fre,1
3086,627201923070959616,neutral,Friday roast Gogle spins Gogle gives masterclas in bad bloging I had some fun with this one goners ,0
3087,627204447630815232,positive,Hapy Friday everybody Does anybody else have a GOGLE page Lets conect if you have one ,1
3088,627532762833121282,positive,The todays photoshot it wil be available on my Gogle profile tomorow MPN ESCREVEAI ,1
3089,627605406827827200,positive, now that Gogle isnt compulsory stil is but wont son then I may give it a go,1
