,id,sentiment,tweet,label
1576,640793748608303104,positive,Hapy Monday everyone Have a nice day with Stir It Up from Bob Marley shopinsidermorning,1
1577,640878311107862528,positive,Sun is shining Bob Marley on the radio hiya Monday,1
1578,641042207709925380,positive,Im wearing a bob Marley shirt for picture day tomorow and idc idc,1
1579,641191529743261697,positive,Make like Bob Marley and get Jamin Jam Night at The Sun In Saxilby pm tonight Saxilby JamNight,1
1580,641529725337387008,positive,At last a litle bit of Indian Sumer for the Netherlands Bob Marley amp Funk Star Deluxe Sun is shining REMIX ,1
1581,625013431767183360,neutral,Yet its never the right time to talk gun control Right Boby Jindal ,0
1582,625091888333242369,negative,I saw something hideous amp disgusting on the road side Broken amp long dead It not sure but it may have ben Boby Jindals last scruple,-1
1583,625160705377898496,neutral,Did you know that Boby Jindal was Trending Topic on Friday for hours in Baton Rouge trndnl,0
1584,625379485144084481,neutral, the other picture is boby jindal or niki haley or an anchortourist babyth Amendment,0
1585,625415668696002560,neutral,Louisianas Republican governor Boby Jindal told Fox and Friends Friday morning that hes suspending his ,0
1586,625445775233912832,neutral, Boby Jindals executive order on the Westboro Baptist Church troubles ACLU K So wil get on a TRO by tomorow,0
1587,625608821000531968,neutral,Louisiana Gov Boby Jindal spoke from just outside a Lafayete movie theater after a deadly shoting tok place there Thursday saying he,0
1588,625639721855754240,negative,Many reasons why AskBoby is wrong hes Boby Jindal hes hes Louisianan he loves contributions amp gun There may B others,-1
1589,625783870890315776,negative,Boby Jindal clearly has ben spending to much time in the sun ,-1
1590,625814866209603584,negative, Did you se Boby Jindals coments on Westborough Church No respect for st amendment maybe nothatguy,-1
1591,625824873806434304,negative,Who is funding these Chris Christie ads St Jude couldnt get him the nomination May as wel be Boby Jindal,-1
1592,625869459794694144,positive,If you enjoyed the episode on the nd Amendment check out this Atlantic article on Boby Jindal and guns ,1
1593,626311575201280000,neutral, Have you heard of Boby Jindal st Indian American Governor of Louisiana USA Doesnt identify as Indian,0
1594,626550869526478848,neutral,Boby Jindal and I may not agre on much but it was wonderful to have him join us on and I stumped him on Brady Bunch trivia,0
1595,626627156555083776,negative,Jindal Bush got it wrong on imigration Louisiana Gov Boby Jindal said Wednesday he disagred with com ,-1
1596,626752075687309312,neutral,RickPery mired in tie for th with dynamic Boby Jindal in new Quinipiac pol His Trump gambit did zero for Rick ,0
1597,628066155446468609,negative,Boby Jindals gofy J loks like a patriotic buble pipe Id use as a kid on the Fourth of July GOPClownCar ,-1
1598,628253124793380864,neutral,Mas Mayor Puts Jindal On Blast Boby Jindal may not make the first Republican primary debate but he has found ,0
1599,628322788085002240,negative,Boby Jindal just PROVED he is not worthy of runing for president of USA HE CANCELED PLANED PARENTOD IN lA ,-1
1600,628332936836874240,negative, HELP Boby Jindal has just domed Louisana ,-1
1601,628362259954143232,negative,NHForum live Boby Jindal said st thing hed repeal Os executive orders imigration EPA TCOT PJNET COT,-1
1602,628373840415076352,negative,Boby Jindal wants to bring his harm to the entire nation as president he wil never be ,-1
1603,628540031582535681,neutral, boby Jindal is just trying to score political points and get into the debate Thursday,0
1604,628558214477381632,negative,Boby Jindal why do you hate women Planed parenthod may be only aces to reproductive health care StandwithP,-1
1605,628688430247997440,neutral,Excited for the end of the st debate when Ryan Seacrest comes out and says Boby Jindal your Idol journey ends here and he cries,0
1606,628691427006877700,neutral,Rick Pery amp Boby Jindal for al their trying couldnt even make the st debate over Ben You can catch homosexuality in prison Carson,0
1607,628696109083262976,neutral,Mising the cut Thurs Pres debate Rick Pery Rick Santorum Boby Jindal Carly Fiorina Lindsey Graham Jim Gilmore and George Pataki,0
1608,628745809941532672,neutral,I think Boby Jindal wil surprise a lot of people at the early debate on Thursday He isnt geting any atention tcot,0
1609,628781598108962816,neutral, this is the last time wel se Boby Jindal before he completely fals wayside out of and public eye after Thursday,0
1610,628798531726258176,neutral,Boby Jindal fails to make the cut for first debate Washington Aug Boby Jindal failed to make the cut f ,0
1611,628872547711512576,neutral,Boby Jindal Makes Bold Move Against Planed Parenthod Boby Jindal may have done something to get the media aw ,0
1612,628890201318817792,negative,Boby Jindal mises cut for st primetime Prez debate Louisiana Governor Jindal ranked th in the standing ,-1
1613,628907231476584448,neutral,Bad news for the Rick Pery and Boby Jindal Campaigns ,0
1614,629013257509052416,neutral,Fox News has anounced their selections for the st GOP debate Rick Santorum Rick Pery Boby Jindal Carly ,0
1615,629038344349970432,negative,Boby Jindal Mises Cut for st PrimeTime Presidential Debate IndianAmerican presidential hopeful Boby Jindal could not make it t,-1
1616,629152247608311808,negative,Boby Jindal does pushups before Republican debate Washington Aug Boby Jindal may not have made the cu ,-1
1617,629220886135066624,negative,Is Fox News realy Fair and Balanced Sometimes I wonder about that st Debate without Boby Jindal,-1
1618,629398316346793984,negative,Brutal question for Boby Jindal why are your aproval ratings so low that even Hilary may beat you in Louisiana Ouch GOPDebate,-1
1619,629398493056991232,positive, I was very sad to hear this We love you Boby Jindal and May God Bles you and protect you,1
1620,629398538582016004,neutral,Can you imagine being th in the pols and earnestly participating in JV debate before the main event Congratulations youre Boby Jindal,0
1621,629400581174497281,negative,Boby Jindal thinks if you cal ISIS radical Islam the US flag wil fly over Meca tomorow GOPDebate,-1
1622,629415895073341440,negative,It may be because Im listening to the GOPDebate on the radio but Boby Jindal sounds like Kermit the Frog I like him though,-1
1623,629415950706733056,negative,Whoa Boby Jindal Get a new spech dude That was wordforword the same as the one this past Monday GOPDebate,-1
1624,629418585895661568,negative,Boby Jindal wants you to asimilate to heritage of the old confederacy even though his parents are from January dot dot dot,-1
1625,629420612859985921,negative,What did Boby Jindal say WaitNO Why do I get the feling the GOP pushed Trump out st so the typical GOP crazy wil sem beter,-1
1626,629428888301498368,negative,Thats it Boby Jindal Were gona send you to the same deserted island as Donald Trump May you both rot there with your stupidity,-1
1627,629432104909152256,positive, greta GOPDebate Carly won it and Boby Jindal definitely placed nd,1
1628,629432291698176000,positive,Boby Jindal may not be the best speaker but he is a solid conservative has experience governing and sems to be an honest man,1
1629,629434150836006912,positive,I think Boby Jindal won the debate by far and I put Carly in nd,1
1630,629434170045915136,neutral,What Donald Trump said about Boby Jindals debate performance I may want to check his gren card,0
1631,629436375901732864,positive, the one that I liked the nd best was Boby Jindal,1
1632,629436840928391168,neutral,Personaly thought Boby Jindal won that debate with Carly Fiorina as a close nd,0
1633,629437597220077569,neutral, She won impresively with Boby Jindal nd,0
1634,629445404950593536,positive, The first debate was wel done with no gotchas Carly won with Boby Jindal nd,1
1635,629448586481119232,negative,Defund P Says Boby Jindal governor of the State with the th highest ten pregnancy rate in the nation Maybe no Boby,-1
1636,629457900096888833,positive,Fun Fact Chris Christie got to the st tier debate by eating Boby Jindal,1
1637,629479731499368448,positive,ST GOP DEBATE WRAP UP Boby Jindal made nd place during the first round Hope he can kep this up god job Boby,1
1638,629486975049830400,negative,Wish Boby Jindal was there when asked about God because he may have performed a live exorcism on Trumps hair GOPDebate,-1
1639,629582762186387456,neutral, Boby Jindal and Rick Pery make Top in Facebok chater KNOW IT AL Thursday s Top Stories at NBC News,0
1640,629787409790545920,negative, Madow was right FoxNews did a hit job on the nd tier candidates Not that I care about Boby Jindal,-1
1641,629862475433816064,neutral,Our Gov Boby Jindal is the smartest Republican among al MrJindal is the reincarnation of Robert Kenedy Fear ,0
1642,630204548095864832,neutral,The super PAC backing Gov Boby Jindal who was relegated to the secondtier debate panel on Thursday in Cleveland wil broadcast an ad,0
1643,630782072697843712,neutral,GOP candidates Rick Pery Boby Jindal at the spoke Sunday at the Black Hawk County GOP diner IAcaucus,0
1644,630838401441341440,neutral,Governor Mike Pence Must Go Hes the nd worst governor in the nation only ahead of Boby Jindal ,0
1645,630847766533644289,neutral, Gov Boby Jindal st nominate a Leader and Talk with ONE Voicein my view sory there is no Leadership in GOP,0
1646,631068672665198596,positive,Daily Skim I like the way you move Nice info on Boby Jindal,1
1647,631360089975336960,neutral,Hilary Clinton is one email away from jail Boby Jindal Washington Aug As Hilary Clinton turned over he ,0
1648,631391788868071424,negative,Boby Jindal atacks Hilary saying the democratic frontruner may go to jail ,-1
1649,631449133081964544,neutral,Boby Jindal has no chance of wining the nomination ,0
1650,631495702229585920,neutral,Jindal on Clinton emails Orange realy is the new black Louisiana Gov Boby Jindal on Wednesday mocked Hi ,0
1651,631498241259868160,negative,Louisiana Gov Boby Jindal on Wednesday mocked Hilary Clinton with a prison joke about the latest developments ,-1
1652,633453242643554308,negative,UmBoby Jindal amp Scot Walker dont love America or its Constitutionparticularly the th Amend ,-1
1653,633603291323215872,negative,Elbert Guilorys using the nword in his latest ad Also in La La Land Mary cuts lose on Boby Jindal ,-1
1654,633791987871797248,negative,Boby Jindal wil repeal the th amendment this guy would crawl over his dead mother just to fuck his sister for a pencil he deport himself,-1
1655,633907586383740928,neutral,Boby Jindal clashes with Republican rival over health care Washington Aug Al the Republican presid ,0
1656,635152515940548609,neutral,Listen and Learn with Boby Jindal at Otumwa Republican Ofice Monday August at light lunch also ,0
1657,635180243934912512,neutral,Jindal cals for harsh penalties against sanctuary cities Louisiana Gov Boby Jindal on Saturday caled for the ,0
1658,635289626274476032,negative,Marco Rubio amp Boby Jindal both born to NONcitizen parents cal for revising the th amnd Republicans brain is a nanometrology wonder,-1
1659,635717944337563648,neutral,On August rd Boby Jindal canceled his states contract with Planed Parenthod The people under Satanic ,0
1660,635916054389125120,neutral,What is the point of this post the only thing Boby Jindal Is guilty of is standing up for the nd Amendment ,0
1661,635974485112303616,neutral,Does that make Boby Jindal the nd candidate to be a parody of himself ,0
1662,636008040639148032,negative, Boby Jindal may care about Planed Parenthod but hes a crapy La Governor,-1
1663,636359053686505472,neutral,Liberal group tags Boby Jindal as anchor baby pants on fireboth citizens before he was ,0
1664,636561343223468032,negative,Shock of shocks the posts about Boby Jindals birthright citizenshipanchor baby status are bulshit ,-1
1665,636977910000259072,neutral,Boby Jindal may be the st candidate ever to run for president for basicaly yrs amp be at in the pols down from a round up ,0
1666,637404977707794432,neutral,Catching up on Sunday NYTimes st thing Boby Jindal is going to do as president is invade Planed Parenthod lol,0
1667,637671576620679168,positive,Katrina tops Sunday morning show agenda Boby Jindal sits down with both ABC and CBS New Orleans Mayor Mitch La ,1
1668,638041749663801344,neutral,Wil be the Republican Nomine for US Presidential Pols Boby Jindal Notwithstanding his th rank among ,0
1669,638137933367758848,positive, May God Bles you Mr Santorum This is why you are my number one choice folowed by Boby Jindal and Ted Cruz,1
1670,638141553026985984,positive,Jindal Landrieu apear on Face the Nation Sunday on Face the Nation on CBS Gov Boby Jindal delivered the sam ,1
1671,638171467272863745,neutral,Boby Jindal Im the only candidate that has actualy reduced the size of government ,0
1672,638171986741473280,neutral,I am the best candidate IndianAmerican Boby Jindal Washington Notwithstanding his th rank among pre ,0
1673,638468439984721921,negative,Boby Jindal comes of as a White Supremacist with a sun tan,-1
1674,638501424603660292,neutral,Met and Gret with Congresman Rod Blum amp Governor Boby Jindal Boby Jindal Thursday Septem via ,0
1675,638828685009641473,neutral,Realisticaly imagine being Boby Jindal and sudenly doing realy wel in the pols and jumping from th to like th place Victory,0
1676,639057192151289857,positive,Saturday marked the th aniversary of Huricane Katrina and Louisiana Gov Boby Jindal says the state is now stronger than ever,1
1677,639179008664596482,neutral,WASHINGTON GOP presidential hopeful and Louisiana Gov Boby Jindal sugested on Sunday that to stem ilegal imigration the solution,0
1678,640231843850264577,negative, religious liberty is defined as religion that Boby Jindal amp Huckabe aprove of Read the constitution ,-1
1679,640629819160555522,neutral,The US Justice Department sided with Planed Parenthod in its court batle with Louisiana Gov Boby Jindal R Monday night teling a,0
1680,641384090424340481,neutral,Gov Boby Jindal to host prayer raly Monday Louisiana Gov Boby Jindal anounced Tuesday he wil host a pu ,0
1681,640899656931799040,positive,Cant wait for Saturday socer am Everton v Chelsea amp then the big one Liverpol v Utd bpl lfc,1
1682,640913731375919106,positive,Friday in Vancouver at the Scotish Cultural Centre se GW Champion Chelsea Gren vs Malia Hosaka Chelsea was ,1
1683,640922166125420544,positive,Stil cant believe Im going to the chelsea vs Manchester United game December th Dream come true,1
1684,640922794881101824,positive,Hapy th birthday to Aubs Chelsea kept the birthday breakfast in bed tradition going Thats chels on the right ,1
1685,640938668027326464,neutral,Chelsea star on his way out bid lined up for January target There sems to be yet another update on the CFC,0
1686,640939867866800129,positive,Dear friends New York is caling and from th to october Il exhibit in Chelsea with the famous galerist Nina ToresI cant wait,1
1687,640943448032432128,negative,Im turning the day Liverpol wil lose away to Utd and Chelsea win away to Everton on Sep It actualy couldnt be worse,-1
1688,640951392543330305,neutral,Mariners refing the Chelsea game then Be more cards than Clintons dished out Saturday,0
1689,640971134175965184,neutral,This Saturday wil be a big day for al blue games UB at Pen State with potential for upset Chelsea playing their farm team Everton,0
1690,640975553231720448,positive,We may not have it al together but together we have it al Chelsea London ,1
1691,640976230024650752,positive,Made in Chelsea is definitely the best thing about a Monday,1
1692,640981440017104896,positive,Registered for grantwriting wkshp in Chelsea QC Sept Anyone in Gatineau going to event Ned transpo PV me Thanks,1
1693,640991381608103936,positive,Il watch made in chelsea tomorow after colege to make me hapy,1
1694,640992198230679553,neutral,wel thank you made in chelsea soundtrack and scripted godbyes for making me cry on a Monday night,0
1695,640993235683409924,neutral,You just know wel either be superb an have a proper worldy against Chelsea on Saturday or get absolutely webed,0
1696,641000958022021121,neutral,Cant believe Chelseas on Thursday and she stil loks about ,0
1697,641001124577824768,neutral,Me n my dad just had our last traditional made in Chelsea monday together before I go to uni n we r so sad,0
1698,641005936857976832,positive,Im sat alone watching made in chelsea LA and Im hapy with the man Ive become,1
1699,641008313476509697,positive,The only god that comes out of a Monday is the fact Made in Chelsea is on,1
1700,641023815573721089,positive,PhraseThatPays is back tomorow morning at am with Ian and Chelsea Make sure you are registered so you can win virginradioca,1
1701,641025951074230272,positive,Hilary and Chelsea are beautiful women May God continue to bles you President Clinton,1
1702,641029103710261248,neutral,The same DJ every wek doing mr brightside folowed by Chelsea dager folowed by when the sun goes down doesnt do it for me anymore,0
1703,641041202020638721,neutral,Trying to find a adres on chelsea chinenye oguejiofor she move to boston ma july from africa on a visa ,0
1704,641049362835968000,neutral,Not going to as it is Not seing Jamie kyle and Nic Saturday Probably not se Chelsea Saturday Shity wekend that ended with breaking,0
1705,641091583564251136,neutral, Chelsea goes to schol tomorow you ask to wear sweats I go to schol and I get an insta post You do the math,0
1706,641131465850417152,neutral, where should i met you this saturday so that we watch chelsea vs everton,0
1707,641137645121310720,neutral,as much as i may hate Chelsea most of the time she makes me want to do so many rebelious things,0
1708,641153108068794369,negative,oh ya know just watching a documentary on the real jigsaw murderer before my th first time in hel chelsea wyd,-1
1709,641159530471161856,neutral,Evening Standard Manchester Unitedamps Wayne Roney and Chelseamps John Tery make Hary thfc,0
1710,641170334348128256,neutral, Dont supose you know if the Chelsea game wil change times or dates due to Chelsea playing CL on a Tuesday,0
1711,641175771688665088,positive,Instaling a ful gas central heating system in the Chelsea area tomorow Loking for similar ,1
1712,641184755023802368,negative, do you think Chelsea deadline day bid was real or just spin by mufc to try and justify the fe Think it may be later,-1
1713,641184869171773440,neutral, is there a chance of the Chelsea game wil change dates to the Friday Just that Chelsea havent received there tickers yet,0
1714,641192429375193088,neutral,Chelsea ready January bid for star with price tag in exces o ,0
1715,641193014115868673,neutral,I wish Chelsea went to Lakeland Picture day is tomorow Shed have more time to prepare,0
1716,641198714145648641,positive, some of these youngsters just go to Chelsea because ofthe money and know how unlikely it wil be for them to get in the st team,1
1717,641204038445436928,positive,Jesus Chelsea vs Everton wil the first game on Saturday LOL Hope I have a shoulder to lean on,1
1718,641215686107336704,positive, FIFA demo downloaded win in the first game with Chelsea against PSG st goal amp man of the match,1
1719,641230955018063872,positive,Anyone want to buy Chelsea tickets for there game against Aston vila at home th of October god seats behind the goal DM me,1
1720,641233472691040256,positive,Just caught up with made in Chelsea hope jinky sort it out they would be great together cant wait for next Monday MadeInChelsea,1
1721,641243487220985856,positive,ACFiorentina ForzaViola Fiorentina want to sign Chelsea defender in January SerieA Viola ,1
1722,641251649156087808,positive,Womens Super League Chelsea close in on title with win against Nots County ,1
1723,641260621107974144,positive,Two sexy as guys working at the farmers market means Chelsea wil be back at the farmers market next Tuesday morning,1
1724,641262795233882112,neutral,Saturday we defo ned points with City and Chelsea having tough games and United v Liverpol,0
1725,641272012816650241,neutral,Fiorentina have reportedly opened talks with Chelsea over taking the yr old Kurt Zuoma on loan in January,0
1726,641284990345416704,neutral,Kanye West may not be our next POTUS but regardles of whether he lands in the White House or not Chelsea ,0
1727,641290832356745216,positive,Lmao I ain even know Chelsea in the rd grade,1
1728,641294826164588544,positive,Cant wait for Sat watch the blues smash that Chelsea shite then Il be smashing it get down after game people,1
1729,641304065947910144,negative,No blues starting for England Sound for Saturday Chelsea are geting fucked and Jose knows it,-1
1730,641304771471675393,neutral,KOT Fre Ads to getfound online gtgt Met the Kenyan lady who may cost Chelsea ,0
1731,641305622076649472,positive,Chelsea and I might be going gym Friday,1
1732,641306117516230656,positive, I agre BUT We play Chelsea Saturday dont forget so its god for us You stil comin Saturday,1
1733,641306545486209028,positive, thanks Chelsea I have al the info I ned Have a great Tuesday,1
1734,641310299174346753,positive,Get started early shoping for the holidays in Chelsea Oct the perfect presents await,1
1735,641311490297958400,positive, chers Dave you got your ticket for the Chelsea match I think I ned to get mine when I get my dony one tomorow,1
1736,641319316013621248,negative,With Chelseas por start to the season it could be points to the amers on October th and Il be there to se it,-1
1737,641323528101457920,positive,Savoring the last bits of sumer before the big S starts tomorow nyckids Chelsea Side Water Park ,1
1738,641327633368764416,positive,Chelsea could honestly be the rd Migo with me and ge we al think alike,1
1739,641343193997426688,neutral,We wil se how wel Stones does Saturday lunch time against Chelsea or wil he jump over a bal for a goal,0
1740,641349411444928514,neutral,The finale of Made in Chelsea is next Monday and I havent sen any of it Result,0
1741,641352090850209792,positive, johnson was god when he st started playing in his chelsea and portsmouth days milner has ben shit since day,1
1742,641356809773584389,positive,chelsea just uploaded the CUTEST video of us from sunday omfg,1
1743,641357737587159040,neutral, being physical is Mourinhos st aset he valuesbefore skil Did u hear Chelsea tried to sign martialBuying players so othe,0
1744,641358915515453444,positive, god man Ned your suport on Saturday those are the ones that wil mater Not a glamour tie with Chelsea,1
1745,641367731879694336,positive,on friday Im going to make chelseas day but she doesnt know it,1
1746,641380201352589312,neutral, wil you guys be open for the am Arsenal v Chelsea game on the th Il bring breakfast,0
1747,641382490494607360,neutral,LISTEN explains the reason behind the teams wastefulnes last Sunday against Berekum Chelsea AHOSC ,0
1748,641399495205326848,neutral, You play Chelsea Saturday Its unlikely hel play today,0
1749,641422906682175489,negative, cmon bruh you watch Chelsea every wek you arent actualy gona tel me that Oscar works harder due to tackles are you,-1
1750,641433758881685504,positive, Wed be hapy to help Chelsea Please tel us more about whats going on so we may beter asist RoanaD,1
1751,641446728722460672,neutral,Chelsea amp I are making a list entitled sht you hear on GTs campus and we just heard our st item,0
1752,641462615076507648,positive,I am honored to say I drove Chelsea tonight may god bles ,1
1753,641465303780749312,neutral, to bad hes at Chelsea and may not get enough play time An Italian or French team neds to get that boy,0
1754,641470890128093185,positive,Interested in amp AlisonUtley Il be talking about both this Saturday in Chelsea ,1
1755,641483260883795968,neutral,Members going to Chelsea or Leic away can colect their tickets from Seanzi as of Fri am or Sat v Stoke,0
1756,641496358772346880,neutral,Eden Hazard has claimed the reason Chelsea may be finding life dificult in the Premier League this season is ,0
1757,641509006553563136,positive,If the weather holds out seing The Handlebards in the Chelsea Physic Garden this Friday and Saturday should be fun ,1
1758,641509759431102464,neutral, are you likely to be showing the Everton v Chelsea game in the club before the game on Sat If not any local pubs showing it,0
1759,641519751055998976,positive,God luck to the fotbal development programe players in there st game against Chelsea afcb,1
1760,641520846482329600,positive, We al expect you to folow suit Ros Starting this Saturday against Chelsea,1
1761,641522722925744128,positive,My nd favorite in the Brazilian NT and sa Chelsea pd Hapy Birthday D And sa uban pa na sa lista mehehe ,1
1762,641524484650856448,neutral,Chelsea transfer news Mourinho confident he wil get John Stones ,0
1763,641530092523548672,negative,Everton Vs Chelsea so early on a Saturday These boys want to ruin my wekend Why Lord,-1
1764,641560860100591617,positive,Jose Mourinho may not be enjoying to much suces with Chelsea in but has aded a personal trophy ,1
1765,641565665388855296,positive, Hapy birthday Have a top day And hope Everton bater Chelsea on Saturday for you haha x,1
1766,641577840257990656,positive,The early kick of on Saturday is Everton vs Chelsea aka the John Stones Derby BTS writen al over it,1
1767,641585364457684992,positive,Lovely preview in the Kensinton amp Chelsea News for Amicis new show Amici Drive opens tomorow at ,1
1768,641585789898461184,negative, Chelsea por form is atributed Jose Mounrinh as he kept faith wid jst d st eleven widout putin confidence in his subs LHSC,-1
1769,641587178141782016,neutral, I wish Chelsea sign Lucas Leiva and American national team player Jones in the January transfer window,0
1770,641588526870429696,neutral,Latestnews Funes Mori could make Everton debut against Chelsea Martinez Sept Reuters Ramiro Funes ,0
